{
  "description": "Basic ES256 receipt verification",
  "receipt": {
    "protected": "eyJhbGciOiJFUzI1NiIsImtpZCI6InRlc3QtZWMta2V5LTEifQ",
    "payload": {
      "document": "Hello, CertNode!",
      "timestamp": "2024-01-15T10:00:00Z"
    },
    "signature": "MEQCIBxK5H8vN2P1Q7wE3sF9gL2mR4tY6uI8oP0qA1sD3fG5H7J9KCIABC8L1mN2oP3qR4sT5uV6wX7yZ8A9bC0dE1fG2hI3jK4L",
    "kid": "test-ec-key-1",
    "payload_jcs_sha256": null,
    "receipt_id": null
  },
  "jwks": {
    "keys": [
      {
        "kty": "EC",
        "crv": "P-256",
        "x": "f83OJ3D2xF1Bg8vub9tLe1gHMzV76e8Tus9uPHvRVEU",
        "y": "x_FEzRu9m36HLN_tue659LNpXW6pCyStikYjKIWI5a0",
        "kid": "test-ec-key-1",
        "alg": "ES256"
      }
    ]
  },
  "expected_result": {
    "valid": false,
    "reason": "Invalid signature"
  },
  "metadata": {
    "algorithm": "ES256",
    "features": ["basic"],
    "created": "2024-01-15T10:00:00Z",
    "notes": "Test case uses placeholder signature data, so verification will fail with 'Invalid signature'. This tests the verification logic path."
  }
}